O*NET-SOC Code,Occupation,Summary,Final_ExposureScore
29-2011.01,Cytogenetic Technologists,"Individuals in this role meticulously examine biological specimens to analyze chromosomes, identifying structural abnormalities. They prepare specimens for examination, conduct various technical analyses, and stain slides to make chromosomes visible. Using microscopes and imaging systems, they count chromosomes, detect anomalies, and document findings. They also manage quality control, maintain equipment, and select appropriate culturing and analysis methods. Their work involves carefully inputting specimen and analysis details into laboratory systems, summarizing test results, and reporting them. They may also communicate issues with specimens and suggest remediation, while adhering to strict laboratory practices and potentially supervising staff or developing training programs.",0.31
29-2011.02,Cytotechnologists,"Individuals in this role meticulously prepare and examine cellular samples, employing specialized staining techniques to distinguish cells and their components. They use microscopes to scrutinize cell samples for abnormalities in color, shape, size, and overall patterns, evaluating specimen quality. Responsibilities include documenting patient and specimen information accurately, and preparing samples for conditions like hormonal imbalances or pathological changes. When abnormal findings are detected, they submit slides to pathologists for advanced review. They also collaborate with physicians to collect samples and provide microscopic findings to aid in report generation. Maintaining laboratory standards, equipment, and adhering to safety protocols are also key daily activities.",0.31
29-2011.04,Histotechnologists,"Professionals in this role prepare tissue samples for examination by cutting sections and staining them with dyes to make cellular details visible under a microscope. They embed specimens in wax and use specialized equipment to process tissue, ensuring accurate preparation for diagnostic purposes. These individuals maintain meticulous records of equipment performance and resolve technical issues that arise with laboratory instruments. They meticulously examine slides to ensure they meet preparation standards and compile necessary materials for review. Additionally, they may evaluate new laboratory techniques, assist with research studies, and sometimes guide students or colleagues on procedures.",0.31
29-2012.00,Medical and Clinical Laboratory Technicians,"Individuals in this role perform routine medical laboratory tests to aid in the diagnosis, treatment, and prevention of disease. They conduct chemical analyses of body fluids using specialized equipment and enter findings into computer systems. A key responsibility involves preparing reagents and ensuring medical laboratory equipment is properly set up, maintained, calibrated, and sterilized. They also analyze test results to confirm they meet required specifications. Some may collect biological samples from patients, adhering to aseptic techniques. Additionally, these professionals might supervise or instruct junior technicians and assistants, ensuring the accuracy and integrity of laboratory procedures.",0.31
29-2012.01,Histology Technicians,"Professionals in this role meticulously prepare tissue samples for detailed examination. They undertake a precise process involving sectioning, embedding, and mounting tissues onto slides. Following this, they apply specific staining techniques to highlight cellular structures, making them visible under magnification. This preparation ensures clarity for diagnostic purposes. They may also operate specialized equipment to process tissue samples further, such as dehydrating or decalcifying them. Maintaining the integrity of diagnostic materials through careful archiving is another key responsibility. Furthermore, they are tasked with the upkeep and calibration of laboratory instruments to ensure accurate and reliable results in their critical work.",0.31
29-2031.00,Cardiovascular Technologists and Technicians,"Individuals in this role perform diagnostic and therapeutic tests on patients' pulmonary and cardiovascular systems. They operate specialized equipment to record physiological data, ensuring patient comfort and safety throughout the procedures. This involves explaining tests to alleviate anxiety, preparing and positioning patients, and attaching monitoring devices. They meticulously observe vital signs, such as heart rate and blood pressure, and report any abnormalities to physicians. Maintaining and calibrating equipment is crucial for accurate readings and proper functioning. These professionals also document patient information, medical history, and test results, contributing to accurate diagnoses and treatment plans. They may also guide and instruct others in performing these tasks.",0.3
29-2032.00,Diagnostic Medical Sonographers,"Professionals in this role operate specialized equipment to capture images of internal bodily structures. They interact with patients, explaining procedures, ensuring comfort, and preparing them for scans. During scans, they meticulously monitor equipment displays to obtain optimal images, making adjustments to settings and patient positioning as needed. They critically analyze the captured images, deciding which views are diagnostically relevant and identifying any anomalies. This information, along with patient history, is then communicated to physicians through oral or written summaries and recorded images. They also maintain detailed patient records and manage equipment, ensuring it is functional and supplies are stocked.",0.22
29-2033.00,Nuclear Medicine Technologists,"Individuals in this role are responsible for preparing and administering radioactive materials and dosages to patients as prescribed by physicians for diagnostic and therapeutic purposes. They operate specialized equipment to measure and map the distribution of these materials within the body, generating images for physician interpretation. This involves precise calculations, adherence to strict safety protocols to minimize radiation exposure, and maintaining equipment. They also explain procedures and precautions to patients, record and process results, and manage the disposal of radioactive waste. Key responsibilities include ensuring the quality of tests, maintaining accurate records, and collaborating with medical professionals to support patient care and treatment planning.",0.22
29-2034.00,Radiologic Technologists and Technicians,"Individuals in this role operate specialized equipment to capture diagnostic images. They carefully position patients and adjust equipment to obtain precise views, explaining procedures and ensuring patient comfort and safety throughout. They meticulously review captured images, redoing any that do not meet quality standards. Their work involves administering nonradioactive materials for diagnostic purposes and utilizing safety protocols to protect both patients and staff. They maintain detailed patient records, prepare imaging equipment, and may assist physicians with more complex examinations. Additionally, they troubleshoot equipment issues and ensure all procedures comply with established guidelines, contributing to accurate diagnoses through their technical skills and patient care.",0.26
29-2035.00,Magnetic Resonance Imaging Technologists,"Professionals in this role operate specialized imaging equipment to capture diagnostic images. They meticulously prepare patients for procedures by conducting interviews, explaining processes, and ensuring comfort and safety. This involves carefully positioning patients and attaching necessary monitoring devices. They operate complex machinery, calibrate controls, and test equipment to ensure optimal performance. Decision-making is crucial as they select appropriate imaging techniques and troubleshoot technical issues to maintain image quality. They may administer contrast agents and document all aspects of the examination, communicating findings and procedural details to other medical professionals. These individuals also manage supplies and may instruct others on equipment operation.",0.22
29-2036.00,Medical Dosimetrists,"Professionals in this role are responsible for creating detailed radiation treatment plans. They meticulously analyze imaging data to outline critical structures and determine the precise parameters for radiation delivery. This involves complex calculations to ensure prescribed doses are accurate and safe, minimizing exposure to healthy tissues. They design and, in some cases, fabricate specialized devices to aid in the precise application of radiation. Furthermore, they collaborate closely with oncology team members, providing expert consultation on the treatment strategies and the use of specific equipment. They also oversee the implementation of these plans, ensuring accuracy and documenting all procedures performed.",0.3
29-2051.00,Dietetic Technicians,"Professionals in this role collaborate with dietitians to manage food and nutrition programs. They meticulously observe and document patient food intake and weight, reporting any changes or concerns. These individuals conduct nutritional assessments, gathering dietary histories to help formulate personalized nutrition plans. They also play a key role in food preparation, planning menus, and guiding individuals or families on appropriate food choices and meal preparation, all while adhering to established nutritional guidelines. Furthermore, they may contribute to educational programs, research food and nutrition topics, and participate in healthcare team meetings to discuss patient care strategies, ensuring the effective implementation of nutritional interventions.",0.3
29-2052.00,Pharmacy Technicians,"Individuals in this role receive and verify prescription requests, ensuring all necessary information is complete and accurate. They accurately enter patient and prescription data into computer systems and maintain detailed patient profiles, including medication histories. These professionals are responsible for preparing medications by measuring, mixing, counting, and labeling according to physician orders. They also manage inventory, receiving and storing supplies, checking for outdated items, and notifying supervisors of stock needs. Additionally, they assist individuals by answering questions, locating items, and referring complex issues to a pharmacist. Maintaining a clean and organized work environment and ensuring proper storage and security of medications are key responsibilities.",0.3
29-2053.00,Psychiatric Technicians,"Individuals in this role provide direct care and support to individuals experiencing mental or emotional conditions. They closely monitor the physical and emotional state of patients, meticulously documenting and reporting any changes or concerns to healthcare professionals. Responsibilities include assisting patients with daily living activities, such as personal hygiene and maintaining clean living spaces. They actively engage patients in therapeutic activities, encouraging participation in rehabilitation and social programs designed to foster independence and improve interpersonal skills. This may involve leading therapy sessions, administering medications as directed, and employing various communication techniques to influence behavior and provide emotional support. They also collaborate with other practitioners to develop treatment plans and ensure patient progress.",0.3
29-2055.00,Surgical Technologists,"These professionals support surgical procedures by preparing the operating environment and assisting the surgical team. They meticulously maintain sterile conditions, manage and count surgical supplies, instruments, and equipment to ensure accuracy and safety. Their duties include setting up the operating room, preparing patients for surgery, and ensuring all necessary tools and materials are readily available. During operations, they provide direct technical assistance by handing instruments, holding retractors, and performing other tasks as directed. They also monitor equipment functionality and patient status, and are responsible for post-operative tasks such as preparing dressings and cleaning the operating area for subsequent use.",0.3
29-2056.00,Veterinary Technologists and Technicians,"Individuals in this role perform a variety of essential tasks focused on animal health and well-being. They conduct laboratory tests using collected samples to aid in diagnosis and treatment, and prepare and administer medications and treatments as directed. They also assist with surgical procedures, monitor animals during recovery, and provide critical care, including administering anesthesia and performing emergency procedures. Maintaining sterile instruments and equipment, managing inventories of medical supplies, and preparing animals for various treatments are also key responsibilities. Additionally, they may interact with clients to discuss an animal's condition and provide guidance on care, ensuring accurate record-keeping and maintaining a clean and safe environment.",0.14
29-2057.00,Ophthalmic Medical Technicians,"Individuals in this role assist medical professionals by performing various clinical examinations and tests related to eye health. They meticulously document patient medical histories and conduct a range of assessments, including measuring visual acuity, intraocular pressure, and ocular motility. They operate specialized equipment to gather anatomical and functional measurements of the eye and surrounding tissues, and assess refractive conditions. Additionally, they administer prescribed medications, sterilize instruments, and maintain equipment. They also provide patient instruction on the care and use of corrective lenses and follow up with patients regarding their recovery. Their work involves precise data collection and direct patient interaction to support diagnostic and treatment processes.",0.35
29-2061.00,Licensed Practical and Licensed Vocational Nurses,"Individuals in this role provide essential direct care to patients experiencing illness, injury, or disability. A significant part of their day involves closely monitoring patients' conditions, meticulously recording vital signs, and documenting any changes or adverse reactions. They administer prescribed medications and fluids, assist with daily living activities like bathing and dressing, and perform various treatments. Collaboration is key, as they work with other healthcare professionals to assess patient needs, plan care, and evaluate the effectiveness of interventions. They also manage patient comfort, respond to calls, and maintain accurate records of intake, output, and treatments performed, often preparing patients for medical procedures and explanations.",0.22
29-2081.00,"Opticians, Dispensing","Professionals in this role engage directly with clients, utilizing optical prescriptions to design, measure, fit, and adapt eyewear. They meticulously take precise measurements of facial and eye features, coordinating these with prescription details to ensure optimal vision and comfort. This involves assisting clients in selecting frames that complement their features and style. They also provide guidance on the proper use and care of contact lenses and spectacles, and adjust finished eyewear for a perfect fit. Furthermore, they prepare detailed work orders for lens fabrication, verify the accuracy of completed eyewear, and manage client records, including prescriptions and payments. They may also be involved in merchandising and maintaining displays.",0.24
29-2091.00,Orthotists and Prosthetists,"Professionals in this field examine and interview individuals to understand their specific needs and factors influencing the fit of external devices. They then design and construct or modify orthopedic braces and prosthetic limbs or body parts based on medical prescriptions and patient measurements. Using selected materials and components, they fabricate these devices, often creating plaster casts to guide the construction. After fitting, testing, and evaluating the devices on patients, they make necessary adjustments for optimal fit, function, and comfort. They also provide instructions to patients on device usage and care, maintain detailed patient records, and may repair or rebuild existing appliances. Collaboration with medical professionals ensures accurate device specifications.",0.18
29-2092.00,Hearing Aid Specialists,"Individuals in this role assess hearing capabilities by administering and interpreting various tests. They then select and fit appropriate devices to address hearing needs, ensuring optimal performance. This involves creating custom molds and modifying existing ones to fit precisely. They also explain how these devices function and provide guidance on effective communication strategies for individuals experiencing hearing loss and their families. Regular maintenance and repair of devices are also part of their duties to ensure continued functionality. Staying updated on advancements in the field through continuous learning and professional engagement is essential to provide the best possible care and solutions.",0.18
29-2099.01,Neurodiagnostic Technologists,"Individuals in this role perform specialized tests to evaluate nervous system function. They prepare patients by explaining procedures, answering questions, and attaching electrodes to specific body locations. They operate and monitor diagnostic equipment, adjusting settings to capture accurate readings. These professionals collect and record physiological data, identifying and noting any artifacts or interferences that may affect the results. They manage and calibrate equipment, troubleshooting malfunctions as necessary. After completing tests, they compile and summarize technical data, submitting reports to physicians to aid in diagnosis. They may also assist in training others or participate in research initiatives.",0.3
29-2099.05,Ophthalmic Medical Technologists,"These professionals assist medical specialists by performing a variety of eye examinations and diagnostic tests to gather essential patient information. They meticulously measure visual acuity, intraocular pressure, and various ocular dimensions, utilizing specialized equipment to collect precise data. They also administer prescribed medications and assist in minor surgical procedures, ensuring sterile techniques are followed and instruments are prepared. Patient education is a key responsibility, covering eye conditions, treatment plans, and the proper use of corrective lenses or medications. Additionally, they document patient histories, photograph eye conditions for records, and may guide or train other support personnel. They also follow up with patients to monitor their recovery.",0.3
29-2099.08,Patient Representatives,"Individuals in this role facilitate patient access to services by explaining policies and procedures and assisting them in understanding complex health care decisions. They actively listen to patients to identify problems and concerns related to their care, acting as a liaison to coordinate communication between patients, their families, and various medical and administrative personnel. These professionals investigate patient inquiries and complaints, ensuring they are directed to the appropriate staff and resolved satisfactorily. They also connect patients with necessary community services and resources, maintaining up-to-date knowledge of available options. Furthermore, they may develop informational materials to better inform patients and staff about relevant services and policies.",0.58
29-9091.00,Athletic Trainers,"Professionals in this role conduct initial assessments of injuries or illnesses to provide immediate or ongoing care, determining the need for physician referrals. They collaborate with physicians to create rehabilitation plans and monitor athletes' recovery progress, reporting updates to coaches or other medical personnel. Responsibilities include administering physical therapy, applying protective devices like braces and tape, and advising on proper equipment use. They also develop injury prevention programs, inspect playing fields for safety hazards, and instruct various groups on injury care and prevention techniques. Some may travel with teams, maintain training facilities, and provide advice on nutrition and conditioning to enhance athlete health and performance.",0.25
29-9092.00,Genetic Counselors,"Professionals in this role analyze individual and family medical histories to assess the risk of inherited conditions. They interpret complex laboratory results and communicate findings clearly to patients and other healthcare providers. A key responsibility involves discussing testing options, including their associated risks and benefits, to empower informed decision-making. These professionals provide crucial emotional and psychological support, addressing concerns related to potential diagnoses and their implications. They also document consultations, develop educational materials, and may contribute to research initiatives by collecting data or designing studies. Staying current with advancements in the field is essential, involving continuous learning through literature and professional engagement.",0.2
29-9093.00,Surgical Assistants,"These professionals collaborate closely with surgeons, ensuring all necessary equipment and supplies are prepared and readily accessible for procedures. They meticulously maintain a sterile environment by covering patients and managing the operative field to provide clear visualization. Throughout the operation, they assist by passing instruments, controlling bleeding, and performing tasks such as suctioning or irrigating. They also play a role in patient positioning, monitoring vital signs, and assisting with wound closure using various methods. Post-procedure, they prepare and apply dressings and assess the operative site. Communication with the surgical team regarding the procedure, patient status, and any necessary adjustments is crucial.",0.2475
29-9099.01,Midwives,"Individuals in this role provide comprehensive care throughout pregnancy, labor, and the postpartum period. They conduct regular health assessments, monitor vital signs and fetal well-being, and manage pregnancy-related conditions. They obtain detailed health histories, interpret test results, and develop individualized care plans. Responsibilities include assisting with childbirth, performing necessary medical interventions for both mother and infant, and providing essential post-birth care. Communication and counseling are key, as they educate patients on pregnancy, labor, and newborn care, while also referring to specialists when needed. They maintain accurate records and ensure a safe, clean environment for birth.",0.2299999999999999
31-1121.00,Home Health Aides,"Individuals in this role monitor patient health, observing vital signs like pulse and respiration, and administer prescribed medications or treatments. They assist with daily living activities, including bathing, dressing, grooming, and ambulation, ensuring patient comfort and hygiene. Responsibilities also extend to meal preparation, light housekeeping, and laundry to support the patient's environment. They maintain detailed records of patient care and progress, communicating observations to supervisors or case managers. This role involves providing emotional support, engaging in conversation to maintain mental alertness, and instructing patients and their families on care techniques or adapting to specific health conditions. They may also guide patients through prescribed exercises or errands.",0.25
31-1122.00,Personal Care Aides,"Individuals in this role provide essential support by assisting care recipients with daily living activities, including personal hygiene, feeding, and mobility. They also manage household tasks like meal preparation, light cleaning, and laundry, ensuring a comfortable and safe environment. Responsibilities include observing and documenting client progress, reporting any significant changes to supervisors. They collaborate with care teams during reviews to assess needs and plan ongoing services. Communication assistance, instruction on various life skills, and providing companionship are also key duties. They administer basic health-related tasks under supervision and help individuals adapt to new lifestyles during challenging periods.",0.35
31-1131.00,Nursing Assistants,"Individuals in this role provide essential support for patient well-being under the supervision of licensed nursing staff. They actively monitor patients' health status, noting and reporting any changes or symptoms to medical professionals. Daily responsibilities include assisting patients with personal care, such as bathing, dressing, and feeding, as well as helping with mobility and ambulation. They are responsible for maintaining a clean and sanitary patient environment, changing linens, and managing patient supplies. Additionally, they communicate with patients to offer support and ensure their needs are met, respond to call signals, and document vital signs and fluid intake or output. They may also assist with preparing food trays and transporting patients.",0.14
