O*NET-SOC Code,Occupation,Summary,Final_ExposureScore
11-1011.00,Chief Executives,"Individuals in this role determine and formulate organizational policies, setting the overall direction of operations. They plan, direct, and coordinate activities at the highest management levels, often delegating responsibilities to subordinate staff. This involves analyzing operations to evaluate performance, identifying areas for cost reduction or policy change, and preparing budgets for approval. They confer with various stakeholders to discuss issues, coordinate activities, and resolve problems, while also reviewing staff reports and implementing corrective actions. Additionally, they may negotiate contracts, establish departmental responsibilities, and ensure functions are coordinated across different sites. They often present information at meetings and serve as liaisons between the organization and external entities.",0.33
11-1011.03,Chief Sustainability Officers,"Individuals in this role develop and execute strategies to address environmental concerns, such as resource conservation, pollution reduction, and waste elimination. They monitor and evaluate the effectiveness of sustainability programs, ensuring compliance with policies and regulations. This involves assessing the viability of sustainability initiatives, managing program documents, budgets, and schedules, and conducting risk assessments. They communicate and coordinate with various stakeholders, including management, employees, and external groups, to foster understanding and engagement. This includes developing reports, presentations, and outreach materials to inform and persuade others about sustainability efforts and to secure funding for environmental projects.",0.33
11-1021.00,General and Operations Managers,"Individuals in this role are responsible for planning and directing overall operations, overseeing multiple departments or locations. They analyze performance data, such as financial statements and sales reports, to identify areas for improvement and cost reduction. Key activities include coordinating production, pricing, sales, and distribution efforts, as well as managing administrative functions related to service or product delivery. They establish operational policies and objectives, often in collaboration with other stakeholders. This includes preparing work schedules, assigning tasks, and performing personnel functions like selection and evaluation. They also manage financial activities to optimize investments and efficiency, and monitor external suppliers to ensure timely and cost-effective provision of necessary resources.",0.4014285714285714
11-2011.00,Advertising and Promotions Managers,"Individuals in this role develop and execute strategies to promote products and services. They plan advertising campaigns, create promotional materials, and oversee their production, ensuring adherence to specifications. Key responsibilities include coordinating with various departments, such as sales and graphic arts, and collaborating with external partners like advertising agencies. They also manage budgets, analyze campaign performance to assess cost-effectiveness, and track response rates against objectives. Staying informed about industry trends is crucial for adapting strategies. This involves conferring with stakeholders, directing campaign teams, and making decisions on media selection and promotional content to drive interest and sales.",0.39
11-2021.00,Marketing Managers,"Professionals in this field plan, direct, and coordinate strategies to promote offerings. They analyze market characteristics and identify target audiences to determine demand for products and services. These individuals develop pricing strategies to maximize profitability and customer satisfaction. They also oversee product development by monitoring trends and consulting with relevant teams on specifications. Professionals collaborate with advertising and promotion managers to implement marketing activities and evaluate their financial impact. They may also negotiate contracts with vendors, establish distribution networks, and analyze research findings. Additionally, they manage staff, oversee training, and conduct performance evaluations to ensure successful execution of marketing plans and initiatives.",0.41
11-2022.00,Sales Managers,"This role involves directing and coordinating the distribution of products or services to customers. Key responsibilities include establishing sales territories, quotas, and goals, and developing training programs for representatives. Individuals in this role analyze sales data to forecast potential and manage inventory needs. They also monitor customer preferences to guide sales strategies and resolve customer complaints. This includes determining pricing, approving expenditures, and ensuring effective operations by advising on policies and procedures. They often engage with department heads to align activities and may represent the organization at industry events to promote offerings. Directing record-keeping and managing staff performance are also crucial aspects of this position.",0.41
11-2033.00,Fundraising Managers,"Professionals in this role develop and implement strategies to secure financial support for various initiatives. They meticulously plan fundraising campaigns and special events, aiming to maximize contributions while controlling expenses. This involves researching potential sources of funding, cultivating relationships with donors and community stakeholders, and clearly communicating the objectives and needs of their projects. They also manage financial resources, establish policies for handling donations, and oversee the work of fundraising teams. Crafting compelling promotional materials, including press releases and publications, is crucial for raising awareness and engaging supporters. Decisions involve setting financial goals, allocating resources effectively, and evaluating the success of outreach efforts to refine future activities.",0.3933333333333333
11-3012.00,Administrative Services Managers,"These professionals oversee and manage various administrative functions critical to an organization's smooth operation. They analyze existing processes, identify areas for improvement, and implement changes to enhance efficiency, often concerning resource allocation or information management. Key responsibilities include setting departmental goals and deadlines, ensuring the timely acquisition and distribution of necessary supplies, and developing strategies for record keeping and disposal. They also monitor operational performance, preparing and reviewing reports to track progress and identify any necessary adjustments. Furthermore, they are responsible for training staff on new procedures and policies, ensuring adherence and understanding across the team.",0.42
11-3013.00,Facilities Managers,"Individuals in this role are responsible for overseeing the day-to-day operations and overall functionality of buildings and their surrounding grounds. They actively monitor environments to ensure safety, security, and proper maintenance, directing efforts for necessary repairs. This includes managing equipment and essential systems, and coordinating construction or renovation projects to enhance efficiency and compliance with various standards. They also handle budgeting, resource allocation, and procurement of necessary supplies, while sometimes educating staff on procedures and reviewing operational reports. These responsibilities require effective coordination, critical thinking, and decisive action to manage diverse operational needs and strategic planning.",0.42
11-3013.01,Security Managers,"This role involves overseeing all security functions to ensure the safety of individuals and property. Key responsibilities include developing and implementing security policies, procedures, and standards. This includes conducting risk assessments, threat analyses, and physical examinations of facilities to identify vulnerabilities and ensure compliance. They investigate security breaches, respond to emergencies, and coordinate with external agencies. This position also involves managing budgets, purchasing necessary equipment, and leading a team of security professionals. This includes hiring, training, and evaluating performance. Communication of security status, preparation of reports, and continuous learning about emerging technologies and regulations are also integral parts of the daily routine.",0.3666666666666667
11-3021.00,Computer and Information Systems Managers,"These professionals oversee daily operations, analyzing workflows, setting priorities, and establishing standards and deadlines to ensure efficient functioning. They collaborate with various stakeholders, including department heads, supervisors, and vendors, to foster cooperation and resolve issues. Their responsibilities include reviewing project plans, assigning and supervising technical staff, and providing crucial support for computer-related challenges. They are tasked with developing robust information resources, ensuring data security, and planning for future technological needs, including disaster recovery. These individuals also evaluate current technology usage, recommend upgrades, and approve system changes before implementation. Additionally, they manage budgets, prepare reports, and stay informed about technological advancements to guide strategic decisions and ensure operational success.",0.44
11-3031.00,Financial Managers,"These professionals manage and guide the financial operations and personnel within their designated areas. They oversee the movement of funds and financial assets, ensuring smooth cash flow. A significant part of their role involves planning and coordinating the activities of their teams, including recruiting and overseeing training programs to develop staff capabilities. They regularly analyze cost-related data to create and manage budgets, making critical decisions to allocate financial resources effectively. Furthermore, they are responsible for cultivating and maintaining positive relationships with both individual and business clients, addressing any issues they may encounter to ensure satisfaction and smooth operations.",0.42
11-3031.01,Treasurers and Controllers,"Individuals in this role oversee and direct an organization's financial operations, including planning, procurement, and investments. They analyze financial details of past, present, and future operations to identify opportunities and areas for improvement, advising management on financial objectives and policies. Responsibilities include developing and implementing internal control policies, guidelines, and procedures for activities such as budget administration and cash management. They also coordinate financial planning and budgeting, monitor financial activities to ensure compliance with requirements, and prepare financial statements and reports. Additionally, they manage relationships with financial institutions and external personnel, and may direct staff training and development in financial management areas.",0.42
11-3031.03,Investment Fund Managers,"These professionals oversee significant pools of capital, making critical decisions to meet investment objectives. They develop and implement strategies for managing investments, aiming to maximize returns while adhering to risk parameters. This involves conducting thorough research and analysis of various opportunities, and evaluating potential new ventures. They select specific investments or investment combinations and direct the execution of trades. A key part of their role is monitoring the performance of existing investments and making adjustments as needed. They also regularly communicate with stakeholders, explaining investment performance, risks, and strategies, and stay informed about market trends and regulatory changes to ensure compliance and identify opportunities.",0.3666666666666667
11-3051.00,Industrial Production Managers,"These professionals plan, direct, and coordinate the activities and resources essential for creating products that meet specific cost, quality, and quantity targets. They analyze operations, review schedules, and evaluate production orders to make crucial decisions regarding staffing, work procedures, and resource allocation, always considering budgetary and time constraints. They interact with technical and administrative teams to resolve operational issues and may oversee hiring, training, and performance management of personnel. These individuals also develop and implement systems for tracking production and quality control, analyzing reports to identify and address potential problems. They are responsible for approving expenditures, initiating cost control programs, and ensuring efficient use of materials, labor, and equipment to meet production goals. Staying informed about industry advancements is also part of their role.",0.38
11-3051.01,Quality Control Systems Managers,"These professionals develop and implement strategies to ensure product and process quality. They formulate policies, direct quality assurance programs, and oversee testing activities across production cycles. Responsibilities include analyzing test results, identifying and resolving quality issues, and stopping production when significant defects arise. They also review and update operational procedures, manage quality documentation, and communicate quality standards to internal teams, vendors, and contractors. These individuals monitor the effectiveness of quality control systems, coordinate the selection of necessary equipment, and analyze data to produce reports on quality trends and nonconformances. They make critical decisions regarding product specifications and direct defect tracking efforts.",0.38
11-3051.02,Geothermal Production Managers,"Professionals in this role oversee daily operations at energy generation facilities, ensuring efficient and safe functioning. They manage and direct teams, communicate operational status, and maintain equipment through regular inspections and preventative care. Their responsibilities include identifying and addressing inefficiencies in equipment or procedures, analyzing systems, and making critical decisions to resolve complex problems. They develop operating plans, manage budgets, and meticulously document all activities and maintenance performed. A key focus is on monitoring operations and implementing improvements to enhance performance and control processes, while also ensuring compliance with operational standards. This involves conducting site assessments, managing resources, and making strategic choices regarding equipment and control systems.",0.38
11-3051.03,Biofuels Production Managers,"Individuals in this role oversee day-to-day manufacturing and plant operations, focusing on production efficiency and product quality. They supervise teams, provide clear direction on operational standards, and ensure adherence to safety and environmental protocols. A key responsibility involves monitoring real-time operational data, such as meters and gauges, to maintain required levels and quickly diagnose and resolve any process abnormalities. This includes making critical adjustments to equipment settings and managing emergency shutdowns or restarts when necessary. They also review performance logs and data to identify trends and potential issues, collaborating with technical staff to address safety, efficiency, or quality concerns. Budget management and resource allocation are also essential components of their role, along with overseeing the proper handling and storage of materials.",0.38
11-3051.04,Biomass Power Plant Managers,"Individuals in this role oversee the daily functioning of power generation sites. They direct the activities of both operational and maintenance personnel, ensuring that work progresses smoothly and safely. This involves reviewing operational logs and reports to verify production levels and identify any abnormalities in equipment or processes. They also conduct site inspections to confirm normal and safe operating conditions. Planning and scheduling key activities, such as deliveries and regular maintenance, is crucial. Managing budgets, inventories, and preparing operational reports are also significant responsibilities. A key focus is evaluating performance and trends to optimize operations and minimize costs, while always prioritizing safety.",0.38
11-3051.06,Hydroelectric Production Managers,"Individuals in this role oversee the day-to-day operations of power generation facilities. They are responsible for monitoring and maintaining equipment to ensure safe and efficient performance. This involves inspecting various components and systems, and ensuring operations comply with regulations and standards. They plan and coordinate production to meet energy demands and develop strategies to enhance operational efficiency. Key duties include managing maintenance activities, responding to system emergencies, and maintaining detailed operational records. They also lead or direct staff in installation, upgrades, and repair tasks, while developing budgets and operational policies. Decision-making is crucial for complex problem-solving and resource management.",0.38
11-3061.00,Purchasing Managers,"Professionals in this role oversee the acquisition of necessary goods and services. They develop and implement strategies for procurement, managing contracts and ensuring compliance with policies. A significant part of their day involves interacting with vendors, assessing product availability, negotiating terms, and evaluating bids. They analyze market trends to forecast needs and identify cost-saving opportunities. These individuals also manage departmental budgets, resolve disputes with suppliers, and maintain meticulous records of transactions. Furthermore, they are responsible for leading teams, including hiring, training, and performance monitoring, to ensure efficient operations and the strategic acquisition of resources.",0.42
11-3071.00,"Transportation, Storage, and Distribution Managers","This role involves directing and coordinating activities related to moving, storing, and distributing resources and products. Key responsibilities include planning workflows, developing operational procedures, and ensuring compliance with established policies and regulations. This involves supervising staff, monitoring inventory, and inspecting facilities and equipment for necessary maintenance or repairs. Collaboration with other departments is essential for integrating logistics with broader business functions. Analyzing operational data, financial impacts, and performance metrics helps in making informed decisions to optimize efficiency and cost-effectiveness. This includes resolving logistical issues, managing budgets, negotiating with external partners, and preparing reports and recommendations for management. Maintaining safety protocols and training personnel are also critical duties.",0.38
11-3071.04,Supply Chain Managers,"Individuals in this role manage and optimize the flow of goods and information. They analyze current processes to identify areas for improvement, focusing on reducing costs and enhancing efficiency and accuracy. This involves directing activities related to purchasing, inventory management, warehousing, and distribution. They develop strategies for material movement and storage, often negotiating terms with suppliers and monitoring their performance to ensure quality and timely delivery. Additionally, they establish performance metrics, coordinate supply chain operations with other departments, and implement new procedures or technologies to streamline operations. They also design supply chains that align with business objectives and consider environmental factors.",0.3666666666666667
11-3111.00,Compensation and Benefits Managers,"These professionals oversee and coordinate all compensation and benefits activities. They develop and update policies to ensure they remain competitive and comply with legal standards, analyzing market trends and government regulations to create effective compensation plans. They manage employee benefit programs, including those resulting from mergers, and often mediate between benefits providers and employees to address questions and concerns. These roles involve directing the communication of benefits information to staff, supervising subordinates, and collaborating with other managers to define job classifications and create new employment policies. They also prepare detailed reports and ensure adherence to all regulatory requirements, researching legislation and contracts to stay informed about industry shifts.",0.36
11-3121.00,Human Resources Managers,"Individuals in this role oversee and manage the activities of personnel and staff. They act as a liaison between management and employees, addressing inquiries, interpreting agreements, and resolving workplace issues. This involves handling challenging staffing situations, including managing shortages, mediating conflicts, and implementing disciplinary measures. They also recruit, interview, and select candidates to fill job vacancies, and conduct orientations for new hires to integrate them into organizational objectives. Additionally, they analyze and adjust compensation and benefits policies to ensure competitiveness and legal compliance, while administering systems for pay, benefits, and performance. They maintain records, compile statistical reports, and prepare budgets for personnel operations, advising management on policies and recommending improvements based on data analysis.",0.36
11-3131.00,Training and Development Managers,"Professionals in this field are responsible for assessing the need for training and development within an organization. They design, develop, and implement a variety of training programs, including classroom sessions, workshops, and on-the-job instruction, to enhance employee skills and knowledge. This involves creating training materials, preparing budgets, and evaluating the effectiveness of both the programs and the instructors. They also conduct orientation for new personnel and train existing staff, including supervisors, in effective instructional techniques. A key aspect of the role involves continuous monitoring and assessment of training activities to ensure they meet organizational goals and potentially external standards, making recommendations for improvements based on performance data and evolving needs.",0.36
11-9013.00,"Farmers, Ranchers, and Other Agricultural Managers","Individuals in this role oversee and manage agricultural operations, making critical decisions regarding resource allocation and problem-solving for issues like pests or weather events. They are responsible for planning and coordinating daily activities, which may include supervising the planting, cultivation, harvesting, and financial aspects of operations. This involves analyzing market conditions to determine planting strategies and negotiating with buyers for the sale and shipment of goods. They also manage personnel, hiring and training staff, and ensuring compliance with legal reporting requirements. Their duties extend to maintaining facilities, equipment, and records, and directing breeding or raising of stock to improve quality. They monitor growing conditions, implement care schedules, and manage irrigation systems to optimize production.",0.245
11-9021.00,Construction Managers,"Professionals in this field are responsible for overseeing and managing the planning, execution, and completion of construction projects. They develop project concepts, establish budgets, and create detailed schedules to ensure timely and cost-effective completion. A significant part of their day involves coordinating and directing subordinate staff and craft workers, conferring with stakeholders such as owners, designers, and contractors to resolve issues and discuss procedures. They review project plans, interpret contract terms, and ensure compliance with building codes and regulations. They also prepare progress reports, manage resources, and negotiate contracts. This role requires making critical decisions, solving complex problems, and adapting plans in response to unforeseen circumstances or site emergencies.",0.24
11-9031.00,"Education and Childcare Administrators, Preschool and Daycare","These professionals oversee and direct daily activities within educational and childcare settings. They develop and implement educational standards, policies, and programs, ensuring compliance with regulations and safety standards. Key responsibilities include managing staff through recruitment, training, and evaluation, as well as monitoring student progress and providing support. They coordinate instructional methods and content, determining the scope of offerings and preparing schedules. Financial and resource management is crucial, involving budget allocation and authorizing purchases. Communication is vital, as they confer with parents and staff about educational activities, policies, and student issues, while also informing external groups about available programs. Record-keeping and reporting are also significant duties.",0.3
