O*NET-SOC Code,Occupation,Summary,Final_ExposureScore
19-2041.03,Industrial Ecologists,"Individuals in this role analyze the environmental impact of products, systems, and projects by examining material and energy flows in production processes. They develop and implement strategies to minimize ecological damage, often by redesigning linear systems into cyclical ones that treat waste as a resource. This involves conducting sustainability assessments, reviewing scientific literature, and building databases of relevant information. They also analyze how human behavior affects and is affected by environmental changes. A key responsibility is preparing technical reports on environmental impacts and recommending methods to protect the environment, translating ecological theories into practical applications. They may also develop alternative energy scenarios and forecast future ecosystem conditions.",0.38
19-2042.00,"Geoscientists, Except Hydrologists and Geographers","Professionals in this field conduct field studies and collect samples to gather data on the Earth's composition and structure. They analyze and interpret geological, geochemical, and geophysical information using specialized software and various data sources like survey results and well logs. These individuals investigate the Earth's crust, examining soils, minerals, rocks, and fossil remains to understand its history. They also identify risks associated with natural disasters and prepare reports, maps, and diagrams to communicate their findings. Their work involves advising on land use, construction projects, and resource management, often by locating potential natural resources or water sources. Furthermore, they measure Earth characteristics like gravitational or magnetic fields and review relevant technical documents.",0.36
19-2043.00,Hydrologists,"Professionals in this role conduct scientific investigations to gather and analyze data about underground and surface waters. They measure and graph phenomena, collect and analyze water samples, and study the physical aspects of the earth related to water cycles. These individuals develop computer models for predictions, design and calibrate monitoring instruments, and evaluate research findings. They apply their knowledge to address issues like water resource management, pollution, conservation, and flood risks. Their responsibilities include preparing reports, coordinating with staff, and providing technical assistance and recommendations on various projects and regulatory matters, ensuring the responsible use and preservation of water resources.",0.36
19-2099.01,Remote Sensing Scientists and Technologists,"Professionals in this field analyze data collected from various platforms, integrating it with other geospatial information to solve complex problems. They process and organize this data, often compiling and formatting imagery to create useful products like maps. These professionals communicate findings through reports and presentations, discussing project details and methodologies with colleagues. They may also design and implement strategies for data collection and analysis, and develop new techniques or systems. Researching advancements, maintaining knowledge of the field, and recommending new technologies are key responsibilities. Some may also train others in the use of specialized technology and participate in fieldwork to collect corroborating data.",
19-3011.00,Economists,"Professionals in this role conduct in-depth research to analyze economic data, often involving mathematical modeling and statistical techniques. They compile and interpret this information to understand economic phenomena, forecast market trends, and evaluate the potential impacts of policies, regulations, or legislation. A significant part of their work involves preparing detailed reports and presenting findings. They also provide expert advice and consultation to various organizations, assisting them in formulating plans to address economic challenges or navigate market conditions. Additionally, they may develop economic guidelines, review others' work, and contribute to teaching or educational settings, sharing their expertise on economic theories and principles.",0.55
19-3011.01,Environmental Economists,"These professionals conduct in-depth research to understand the complex interplay between economic activities and environmental conditions. They collect and analyze data to evaluate the costs and benefits of various policies, regulations, and practices affecting natural resources. Using economic principles and statistical techniques, they develop models and forecasts to predict future outcomes and assess long-term impacts. Their work often involves assessing the economic implications of environmental challenges and proposing cost-effective solutions or policy recommendations. These individuals communicate their findings through written reports, academic articles, and presentations, aiming to inform decision-makers and promote sustainable practices by demonstrating the economic advantages of environmental stewardship.",0.55
19-3022.00,Survey Researchers,"Professionals in this field develop and execute research plans to gather information. They collaborate with stakeholders to define research objectives and specific requirements, often consulting on sample needs. These individuals design survey instruments, establish data collection procedures, and oversee the entire research process. Their day-to-day activities involve conducting surveys through various methods like interviews or questionnaires, monitoring progress, and ensuring data quality. They analyze collected data, interpret findings, and prepare comprehensive reports with visual aids. Additionally, they may supervise and train staff, document methodologies, and write proposals to secure future research projects, ensuring all aspects of the survey adhere to established protocols.",0.56
19-3032.00,Industrial-Organizational Psychologists,"Professionals in this field analyze and address human resource and organizational challenges by applying psychological principles. They design and implement systems for employee selection, placement, and promotion, often developing specialized tests and interview techniques. Daily tasks involve assessing job requirements, observing workers, and analyzing data to evaluate program effectiveness and productivity. These individuals advise management on policies and practices, facilitate organizational development, and coach leaders. They also conduct research, write reports on findings, and present insights to various audiences, contributing to improved worker performance and organizational efficiency. Some may also provide expert testimony or counsel employees on career matters.",0.39
19-3033.00,Clinical and Counseling Psychologists,"Individuals in this role assess, diagnose, and treat mental, emotional, and behavioral disorders. They conduct interviews, administer psychological tests, and review case histories to understand clients' issues. Developing and implementing individualized treatment plans using various therapeutic techniques is central to their work. They provide counseling to help clients gain insight, manage distress, and achieve personal, social, educational, or vocational adjustments. Documentation of client progress, session notes, and treatment plans is essential. They also consult with other professionals and may provide training or educational programs. This involves critical thinking to evaluate treatment effectiveness and adapt approaches as needed, while maintaining professional knowledge.",0.3899999999999999
19-3034.00,School Psychologists,"Professionals in this field assess individuals to identify educational, behavioral, or developmental challenges impacting their learning. They interpret assessment results and collaborate with educators, families, and other personnel to develop and implement intervention strategies. This involves counseling individuals and families, maintaining confidential records, and providing consultation on learning and behavioral approaches. They also collect and analyze data to evaluate program effectiveness, design educational programs, and facilitate understanding of child development. When necessary, they report concerns about child welfare and refer individuals to external support services. They continually engage in professional development to stay current with advancements in their field.",0.39
19-3039.02,Neuropsychologists,"Individuals in this role conduct evaluations to assess cognitive functions such as intelligence, memory, and attention. They interview patients to gather detailed medical histories and administer various tests. Based on the data collected from these assessments and interviews, they diagnose conditions impacting the central nervous system. Professionals write comprehensive reports detailing their findings and may consult with other specialists regarding patient care. They also establish baseline measures for monitoring disease progression or recovery. Some individuals design and implement rehabilitation plans for cognitive dysfunction, provide education and counseling to patients and their families, and may supervise students or staff. Staying current with developments in the field through literature and professional engagement is also a key responsibility.",0.39
19-3039.03,Clinical Neuropsychologists,"Professionals in this role conduct comprehensive evaluations to assess cognitive and neurobehavioral functions, focusing on how nervous system disorders affect behavior. They interview individuals to gather detailed medical histories and administer various tests to measure abilities like intelligence, memory, and language. Based on this data, they write detailed reports, diagnose conditions resulting from brain injuries or illnesses, and distinguish between different causes of dysfunction. They then develop and recommend treatment plans, which may include therapy or other interventions. These professionals also collaborate with other specialists, monitor patient progress before and after medical procedures, and provide education to patients, families, and students.",0.39
19-3041.00,Sociologists,"Professionals in this field examine human society and social behavior by studying the groups, organizations, and institutions people form. They collect data through observation, interviews, and document reviews to understand attitudes, values, and behaviors. Researchers develop and test theories about societal issues, analyzing data to understand social dynamics. They design and implement data collection methods, and may write grants for funding. Findings are often communicated through publications, reports, and presentations to colleagues or the public. They may also consult with others on social issues, advise on policies, and direct the work of support staff. Collaboration with peers in related fields is also common.",0.48
19-3051.00,Urban and Regional Planners,"These professionals develop and administer plans and policies that guide land use and development. They conduct research and analyze data on economic, social, and environmental factors impacting communities. They prepare reports and maps to visualize land use and demographic information. Professionals in this role collaborate with government officials, experts, developers, and the public through meetings and discussions to address land use issues and formulate plans. They assess the feasibility and potential impacts of proposed projects, recommending approval or denial. They also mediate disputes, identify sustainability opportunities, and ensure compliance with regulations. Some may also guide the work of technical staff and coordinate with consultants.",0.49
19-3091.00,Anthropologists and Archeologists,"Individuals in this role analyze human culture and societal development through meticulous observation, interviews, and the examination of historical records and artifacts. They formulate theories to explain the origins and evolution of past and present cultures, documenting their findings through detailed written reports, presentations, and data records. A significant aspect of their work involves advising various entities on the potential cultural impacts of proposed initiatives and collaborating with diverse groups to address issues related to resource management and community well-being. They may also develop interventions, design research projects, seek funding, and educate others, including students and the public, about different cultural practices and historical societies.",0.48
19-3092.00,Geographers,"Individuals in this role research and analyze the Earth's surface, focusing on the interplay between physical features and human activities. They gather diverse geographic data from various sources, including fieldwork, satellite imagery, and existing databases. A key responsibility involves analyzing spatial patterns of both natural phenomena and societal characteristics, such as economic, political, and cultural traits, across different scales. They create and update visual representations like maps and graphs using specialized software. Additionally, these professionals may consult on issues related to resource management, business planning, and environmental concerns, and they are often tasked with presenting their research findings through reports and presentations.",0.48
19-3093.00,Historians,"Individuals in this role engage in thorough research, critically analyzing diverse sources to interpret the past. They gather information from archives, personal accounts, and published materials, meticulously organizing and evaluating its significance and authenticity. A key part of their work involves presenting findings through written publications, exhibits, or oral presentations, ensuring historical accuracy and communicating complex information to various audiences. They also advise on the preservation and interpretation of historical materials and sites, and may conduct interviews to record oral histories. Decisions are made regarding research topics, methods, and the dissemination of findings, often involving collaboration or consultation.",0.47
19-3094.00,Political Scientists,"Individuals in this role research and analyze governmental and political structures, focusing on their development, operation, and impact. They meticulously collect and interpret data from various sources, including public opinion surveys, election results, historical documents, and current policy information. Key responsibilities involve developing and testing theories related to political phenomena, forecasting future trends, and evaluating the implications of policies and legislation. Findings are synthesized into reports, academic publications, or presentations to share insights and conclusions. They also contribute to academic environments by teaching and advising students, and participate in committees, applying their expertise to broader organizational goals while maintaining awareness of current governmental decisions.",0.47
19-3099.01,Transportation Planners,"Professionals in this role analyze and interpret complex data to understand current and future needs related to mobility and infrastructure. They develop comprehensive studies and sophisticated models to simulate various scenarios and predict outcomes. A significant part of their work involves evaluating proposed projects, assessing environmental impacts, and ensuring compliance with regulations. They collaborate with diverse teams, including engineers and other professionals, to formulate recommendations and strategies for system improvements. Engaging with stakeholders through public meetings is crucial for gathering feedback and achieving consensus. Ultimately, they prepare detailed reports, documentation, and plans to support decision-making and secure necessary approvals for initiatives aimed at enhancing transportation systems.",0.53
19-4012.00,Agricultural Technicians,"Individuals in this role support scientific research and development in agriculture by preparing and maintaining laboratory or field equipment. They collect samples from crops and animals, and meticulously record data related to experiments or care. A significant part of their day involves conducting tests and experiments to improve crop yields and quality, as well as enhance the resistance of plants and animals to diseases and pests. They also examine specimens to identify issues and may be involved in animal breeding and nutrition studies. Routine maintenance and repair of equipment ensure continuous operation. They collaborate with scientists, interpret findings, and contribute to the advancement of agricultural practices.",0.26
19-4012.01,Precision Agriculture Technicians,"These professionals collect and analyze data using geospatial technologies to inform agricultural practices. They gather information on soil attributes, field boundaries, and yield performance, often utilizing field recorders and mapping software. They create detailed maps layering information such as soil types, crop yields, and application patterns to identify trends and areas needing specific attention. Based on this analysis, they develop site-specific management plans, recommending crop varieties, seeding rates, or targeted treatments to optimize resource use and minimize environmental impact. They also install, calibrate, and maintain various sensors and guidance systems, ensuring the accuracy of data collection and application processes. They communicate findings through reports and advise on technology upgrades.",0.26
19-4013.00,Food Science Technicians,"Individuals in this role conduct standardized tests on various food and beverage items to determine their physical and chemical properties, ensuring they meet established standards for factors like color, texture, and nutritional content. They meticulously measure and analyze samples, often using specialized equipment and microscopic examination, to identify components or contaminants. Maintaining detailed records of testing results and equipment calibration is crucial. These professionals also assist with research and development, contribute to quality control processes, and may train new personnel or supervise other technicians. They often monitor and control product conditions, such as temperature, and compile findings into reports, graphs, or charts for review and compliance.",0.26
19-4021.00,Biological Technicians,"Individuals in this role support scientific research by preparing, setting up, and maintaining laboratory equipment and instruments. They meticulously monitor experiments, collect data and biological samples, and precisely record observations. Calculations are performed, and results are analyzed and interpreted to generate reports and summaries. These professionals often troubleshoot equipment issues, ensure adherence to standards, and maintain clean and organized work areas. They also manage supplies and input data into various systems, contributing essential technical support to scientific endeavors. Their work involves careful documentation and analysis to aid in the understanding and advancement of scientific knowledge across various fields.",0.38
19-4031.00,Chemical Technicians,"Individuals in this role conduct a variety of laboratory tests on different types of materials, performing qualitative and quantitative analyses. They prepare chemical solutions and set up experiments using various techniques. A key responsibility involves monitoring product quality to ensure it meets set standards and specifications. These professionals compile, interpret, and document test results through written reports, graphs, or charts. They also maintain and clean laboratory instruments and equipment, while ensuring a safe work environment through participation in safety programs and audits. Additionally, they provide technical assistance and training to colleagues, and manage inventory of necessary materials to support ongoing operations and experiments.",0.26
19-4042.00,"Environmental Science and Protection Technicians, Including Health","Individuals in this role conduct laboratory and field tests to assess environmental conditions and pinpoint pollution sources that may affect public health. They meticulously collect various samples, including gases, soil, and water, for thorough analysis. These professionals calibrate testing instruments to ensure accuracy and then perform complex calculations and measurements to determine pollutant concentrations. They meticulously record their findings, often creating detailed reports, summaries, or charts to interpret the data. Additionally, they inspect facilities for potential health and safety hazards, offering recommendations to mitigate risks and improve conditions. They also provide technical assistance and information to various stakeholders regarding environmental protection and safety measures, maintaining organized records of their work.",0.38
19-4043.00,"Geological Technicians, Except Hydrologic Technicians","Individuals in this role support scientific endeavors by using specialized instruments to gather data for exploration and production activities. They meticulously analyze various samples, such as mud and drill cuttings, to determine their composition and properties. Charting critical well or borehole characteristics like pressure and temperature is a key responsibility. They also compile, log, and record this operational data for further review and analysis. Preparing detailed notes, sketches, and geological maps are common duties, aiding in the visualization and understanding of subsurface conditions. Adjusting and maintaining testing equipment ensures the accuracy and reliability of collected information.",0.27
19-4051.00,Nuclear Technicians,"Professionals in this role support scientists and engineers by operating, maintaining, and ensuring the quality of specialized equipment. They closely monitor systems and equipment performance, identifying potential inefficiencies, hazards, or the need for repairs or adjustments. A key responsibility involves adhering to strict operational policies and safety procedures, particularly concerning radiation exposure and environmental protection. They apply safety measures, test equipment to confirm proper functioning, and may modify or maintain equipment to meet operational requirements. These actions are critical for maintaining safe and efficient operations, often involving detailed record-keeping and communication to ensure all activities comply with established guidelines and protocols.",0.26
19-4051.02,Nuclear Monitoring Technicians,"Professionals in this field regularly collect and analyze various samples, such as air and water, to assess radioactivity levels and identify contaminants. They meticulously monitor work areas, equipment, and personnel to determine radiation intensities and exposure levels using specialized instruments. A key responsibility involves calculating safe exposure times based on contamination readings and established limits, and promptly informing supervisors when these limits are approached. They provide initial responses to alarms and abnormal events, and can be called upon to decontaminate objects or manage radioactive waste. Additionally, they instruct others on safety procedures, demonstrate the use of protective gear, and document their findings and decontamination methods in reports.",0.26
19-4061.00,Social Science Research Assistants,"Individuals in this role support research endeavors by gathering and managing information. They conduct research using various resources and may prepare materials for publication, such as reports, tables, and graphs. A significant part of their work involves managing extensive databases, ensuring data accuracy and validity through quality control procedures and error correction. They also perform statistical analyses using specialized software and may contribute to the preparation of findings for presentations. Additionally, they assist in preparing project-related documentation and may present research outcomes to groups. Their daily activities involve a combination of data handling, analytical tasks, and supportive administrative functions to advance research projects.",0.57
19-4071.00,Forest and Conservation Technicians,"This role involves providing technical support for natural resource conservation, focusing on areas like soil, water, and forests. Day-to-day activities include collecting data on forest characteristics, which may be used for management decisions. Individuals in this position often lead and instruct teams in tasks such as planting, fire prevention, and maintaining facilities. They also patrol areas to ensure resource protection and enforce relevant regulations concerning environmental practices and safety. Additionally, they contribute to managing and improving conservation lands and wildlife habitats by gathering information and mapping data. This requires careful observation, problem-solving, and effective communication to ensure resources are preserved and utilized appropriately.",0.21
