O*NET-SOC Code,Occupation,Summary,Final_ExposureScore
47-4021.00,Elevator and Escalator Installers and Repairers,"Professionals in this field install, assemble, maintain, and repair mechanical and electrical systems for vertical and horizontal transportation. They meticulously inspect wiring, control panels, and moving parts, ensuring proper alignment and clearance. When malfunctions occur, they troubleshoot and diagnose issues using specialized testing equipment, then disassemble units to repair or replace worn or broken components. They work from blueprints to understand system layouts and select appropriate tools and equipment for installation and repair tasks. Compliance with safety regulations and building codes is a critical aspect of their work, documented through detailed reports and logbooks. These individuals ensure the safe and efficient operation of complex equipment through skilled repair, maintenance, and adherence to specifications.",0.17
47-4031.00,Fence Erectors,"Individuals in this role are responsible for constructing and repairing various types of barriers, walls, and gates. They begin by assessing project needs, which includes communicating with customers to understand their requirements and providing price estimates. A crucial part of their work involves carefully measuring and marking fence lines, then preparing the ground by digging postholes and ensuring the area is free from underground utilities. They meticulously set posts, ensuring they are plumb and secure, often by embedding them in concrete or compacted soil. Subsequently, they assemble and attach framing, stretch and secure fencing materials, and construct or repair gates. This process demands precision in cutting and fitting materials, using a variety of hand and power tools, and sometimes welding metal components.",0.09
47-4041.00,Hazardous Materials Removal Workers,"Individuals in this role are responsible for the safe identification, containment, removal, and disposal of hazardous substances. They meticulously prepare work areas by building containment structures and then use various tools and equipment to extract contaminated materials. This involves careful handling, packing, and loading of substances for transport and proper disposal, adhering strictly to safety protocols and regulations. They also clean contaminated equipment and sites, ensuring that all materials are managed responsibly and safely. Decision-making is critical in assessing risks, selecting appropriate methods, and operating machinery effectively to prevent further contamination and ensure environmental safety. Monitoring and quality control are ongoing throughout the process.",0.09
47-4051.00,Highway Maintenance Workers,"Individuals in this role focus on the upkeep and repair of infrastructure, particularly roadways and associated areas. Their daily activities involve operating vehicles and equipment to perform repairs on pavement, guardrails, and drainage systems. They also manage vegetation by clearing brush and mowing, and ensure safety by setting up traffic control devices and warning motorists. These professionals conduct routine inspections and maintenance on vehicles and tools to ensure operational readiness. They are responsible for clearing debris, including snow and litter, from pathways and structures. This work requires attention to detail, problem-solving skills, and the ability to operate various tools and machinery effectively to maintain functional and safe conditions.",0.09
47-4061.00,Rail-Track Laying and Maintenance Equipment Operators,"These operators are responsible for the construction and upkeep of rail lines. They operate specialized machinery to lay new track, making precise adjustments to ensure proper alignment and levelness. Daily tasks involve monitoring equipment performance, performing routine maintenance, and lubricating components. They also conduct repairs on various track elements, such as switches, and may weld sections of rail. Safety is paramount, requiring careful observation of indicators and adherence to operational controls. Operators also perform cleaning duties, clearing debris, snow, or ice from the tracks and ensuring ballast is properly maintained. When needed, they troubleshoot issues and perform repairs to keep the rail infrastructure in optimal condition.",0.09
47-4071.00,Septic Tank Servicers and Sewer Pipe Cleaners,"Individuals in this role are responsible for maintaining and repairing underground systems that carry waste materials. They use specialized equipment to clear blockages and inspect lines for issues, often identifying problems using diagnostic tools. A significant part of their day involves operating machinery to clean pipes and tanks, and performing manual labor like digging when necessary. They meticulously document all maintenance and repair actions taken. This work also requires coordinating with team members, potentially driving vehicles to transport necessary tools and personnel, and performing routine checks and minor repairs on their own equipment to ensure operational readiness and safety. Making decisions based on problem analysis is key.",0.1
47-4091.00,Segmental Pavers,"Professionals in this role prepare the ground for installation by removing unsuitable materials, compacting soil, and ensuring proper drainage. They then supply and place base materials, bedding sand, and edge restraints. Decisions are made regarding paver layouts, patterns, and precise markings for alignment. They cut paving units to size using specialized tools and carefully set them, ensuring correct spacing. After placing the pavers, they compact the bedding sand and the units themselves to create a finished surface. Finally, they fill the joints with sand, compacting to ensure they are full, and sweep excess sand from the completed area.",0.105
47-4099.03,Weatherization Installers and Technicians,"Professionals in this field assess structures to identify areas needing improvement for energy efficiency. They perform diagnostic tests on heating, cooling, and air flow systems to detect issues like air leakage. Based on these assessments, they execute various improvements. This includes installing insulation in attics, walls, and crawl spaces, as well as sealing ducts and openings to prevent energy loss. They also conduct minor repairs to components like windows and walls, and apply materials to reduce drafts. Furthermore, they explain conservation measures and recommendations to clients, ensuring proper understanding of the work performed and its benefits. Maintaining accurate records of activities and materials used is also a key responsibility.",0.09
47-5011.00,"Derrick Operators, Oil and Gas","Individuals in this role are responsible for the operation and maintenance of derrick equipment and associated pumps. They conduct regular inspections of derricks to identify potential flaws and ensure optimal working conditions through cleaning and lubrication. A key duty involves controlling the characteristics of drilling fluids, which includes mixing components, weighing materials, and preparing mud reports for crew members. They monitor pump operations, listening for unusual sounds or vibrations, and make necessary repairs to pumps and related equipment. Additionally, they manage the circulation of fluids through drill pipes, assist with pipe handling, and ensure proper assembly and alignment of derrick components. They may also oversee and train crew members on operational procedures and chemical handling.",0.19
47-5012.00,"Rotary Drill Operators, Oil and Gas","These professionals operate and maintain specialized equipment to extract underground resources or collect geological samples. They closely monitor operational performance, making adjustments to controls like throttles and levers to regulate equipment speed and pressure. Their day involves connecting and disconnecting equipment components, maintaining machinery through lubrication and part replacement, and troubleshooting issues to ensure smooth operations. They meticulously record details about the drilling process, including depth, materials used, and encountered geological formations. Additionally, they oversee and instruct crew members, ensuring safety protocols are followed and guiding activities such as equipment setup and well servicing. They prepare necessary materials, like drilling fluids, and manage the removal of samples for analysis.",0.19
47-5013.00,"Service Unit Operators, Oil and Gas","These professionals operate specialized equipment to enhance the flow of resources from producing wells or to retrieve items stuck in wells. They perform regular safety inspections on tools and equipment, and listen closely to machinery to identify any operational issues or unusual conditions. When necessary, they install specialized pressure-control devices. They analyze instrument readings to determine the depth of obstructions, and use their judgment to select appropriate methods and tools for removing obstacles. Communication with colleagues is essential for gathering critical information about well conditions and equipment. They also maintain detailed records of services performed, tools utilized, and time spent, often driving specialized units to various work locations.",0.19
47-5022.00,"Excavating and Loading Machine and Dragline Operators, Surface Mining","Operators control heavy machinery to excavate and move loose materials. They receive instructions about material movement and excavation needs, then interpret digging plans and machine capabilities to perform tasks. This involves operating levers, pedals, and controls to manipulate equipment according to specifications, often guided by signals or markings. Operators ensure machinery is set up and inspected before use, performing routine lubrication, adjustments, and repairs, including replacing worn parts. They monitor operations for safety and efficiency, manage various site conditions like slides or cleanings, and create or maintain inclines and ramps. Regular maintenance and troubleshooting are key to ensuring equipment functions correctly and safely for the intended operations.",0.15
47-5023.00,"Earth Drillers, Except Oil and Gas","Individuals in this role operate specialized equipment to create holes in the earth. They meticulously select and attach appropriate drilling tools, then control the equipment to bore into various materials, adjusting settings based on subsurface conditions. Their daily work involves precisely positioning and stabilizing machinery, managing the insertion of casings, and regulating speed and pressure to achieve desired depths and alignments. They regularly monitor operations, perform essential maintenance and repairs on equipment, and document progress and geological findings. These professionals also manage logistical aspects, including transporting equipment to work sites and ensuring tools are properly assembled and maintained for safe and effective operation.",0.18
47-5032.00,"Explosives Workers, Ordnance Handling Experts, and Blasters","Individuals in this role are responsible for carefully placing and detonating explosive materials. They assess blast areas to determine the precise type and quantity of explosives required, while rigorously adhering to safety regulations. This involves preparing blast sites, positioning charges, and connecting initiation systems to achieve timed sequences. They ensure all personnel are safely cleared before initiating detonations. Additionally, responsibilities include managing the storage, transport, and inventory of materials, maintaining detailed records, and performing necessary maintenance on equipment. Decision-making is critical for ensuring safety and operational success in complex environments.",0.16
47-5041.00,Continuous Mining Machine Operators,"These professionals operate specialized machinery to extract and move materials from underground locations. They control the equipment using various levers and controls, ensuring continuous operation and efficient material transfer to transport systems. A significant part of their day involves monitoring the machinery's performance, listening for any unusual sounds that might indicate malfunctions, and taking immediate action to address them. They also perform routine maintenance, such as cleaning, oiling, and replacing worn parts, to keep the equipment in optimal working condition. Additionally, they assess the safety of the work area, checking for structural stability and air quality, and make necessary adjustments to ventilation systems. They must make critical decisions regarding equipment positioning and operation to maximize productivity and ensure safety.",0.17
47-5043.00,"Roof Bolters, Mining","Individuals in this role operate specialized machinery to install essential support systems underground. They meticulously drill holes into overhead structures at precise intervals, ensuring stability by securing them with various anchoring devices. This process involves carefully positioning equipment, inserting and operating drilling tools, and then firmly inserting and tightening anchor bolts. They also assess and remove unstable materials, conduct safety checks, and perform tests to monitor environmental conditions. Maintaining equipment through routine checks and repairs is a key responsibility. Additionally, they may manage airflow systems and ensure that installed supports meet required tension and safety standards before proceeding to the next area, demonstrating a commitment to structural integrity and operational safety.",0.17
47-5044.00,"Loading and Moving Machine Operators, Underground Mining","Operators control specialized machinery to load and move materials such as coal, rock, and ore. They maneuver equipment to gather materials and direct them into transport systems like cars or conveyors. This involves operating levers and controls to position booms or shovels precisely. They also drive vehicles to designated discharge points, ensuring loads are properly transferred. Daily responsibilities include monitoring the loading process for accuracy, clearing obstructions from paths, and maintaining equipment through cleaning, fueling, and minor repairs. They must also manage power cables and adhere to safety signals and guidelines while performing their duties.",0.185
47-5051.00,"Rock Splitters, Quarry","Workers in this role meticulously examine large stone masses, identifying natural patterns and lines to guide their actions. They operate specialized equipment to carefully separate desired blocks from the main formations. This involves precise insertion of tools and controlled application of force to achieve clean breaks. They also mark the stone, indicating dimensions and outlines to ensure accurate cuts. Decision-making is critical for selecting the best methods to split the material according to specifications, managing resources effectively, and ensuring the quality of the separated pieces. Continuous monitoring of equipment and work progress is essential for safety and efficiency.",0.17
47-5071.00,"Roustabouts, Oil and Gas","Individuals in this role perform essential hands-on tasks related to the setup, maintenance, and repair of specialized equipment. They routinely use various hand and power tools to assemble, disassemble, and secure components, ensuring operational integrity. This involves tasks such as tightening or loosening pipes and rods, bolting engine parts together, and guiding heavy materials. They also conduct inspections to identify and fix issues like leaks in flow lines, often employing specialized detection methods. Additionally, their responsibilities include moving materials, laying pipelines, and maintaining vehicles used in operations. This requires careful attention to detail, coordination with others, and the ability to troubleshoot and resolve mechanical challenges effectively.",0.19
47-5081.00,Helpers--Extraction Workers,"Individuals in this role provide essential support for skilled craft workers. Their day-to-day activities involve monitoring equipment performance, identifying potential issues, and assisting with adjustments to machinery used in extraction processes. They are responsible for transporting materials and parts to work sites, often operating vehicles. Additionally, they prepare sites for operations, organize materials for efficient use, and load necessary items into equipment or designated areas. This work includes performing routine maintenance and repairs on equipment using hand tools. After operations conclude, they ensure the work area is clean and free of debris, maintaining a safe and organized environment.",0.11
49-1011.00,"First-Line Supervisors of Mechanics, Installers, and Repairers","This role involves overseeing and coordinating the daily activities of mechanics, installers, and repairers. Key responsibilities include monitoring work progress, reviewing performance, and ensuring adherence to quality and safety standards through inspections and training. This position requires making decisions on task assignments, scheduling, and resource allocation, such as requisitioning necessary materials and parts. Interactions are frequent, involving conferring with team members, management, and potentially customers to resolve issues, provide guidance on services, and address grievances. The role also includes counseling employees, recommending personnel actions, and investigating incidents to maintain efficient operations and a safe working environment.",0.1854545454545454
49-2011.00,"Computer, Automated Teller, and Office Machine Repairers","These professionals diagnose and fix malfunctioning electronic office equipment. They begin by listening to users to understand the problem, then disassemble devices to inspect components for wear or defects. They use various tools and diagnostic equipment to pinpoint issues, replacing or repairing faulty parts and recalibrating systems. After repairs, they reassemble and test the equipment to ensure proper functioning. They may also install new equipment, configure software, and provide guidance to users on operation and maintenance. Maintaining accurate records of work performed and parts used is also a key responsibility, along with managing inventory and ordering necessary supplies.",0.245
49-2021.00,"Radio, Cellular, and Tower Equipment Installers and Repairers","Individuals in this role are responsible for installing, maintaining, and repairing communication equipment. They interpret technical documents, blueprints, and work orders to guide their actions. Their day involves physically installing components, such as antennas, mounts, and cables, ensuring secure and proper placement. They meticulously test and verify that equipment functions correctly, often using specialized tools to analyze signal strength and network coverage. Following installation or repair, they conduct thorough inspections to confirm all work meets specifications and safety standards. This requires careful coordination, precise execution of tasks, and attention to detail, ensuring reliable communication systems. They also maintain records of their work and document progress through reports and photographs.",0.24
49-2022.00,"Telecommunications Equipment Installers and Repairers, Except Line Installers","These professionals install, set up, and reconfigure communication systems. They meticulously test circuits and components using various tools to diagnose and isolate malfunctions. After identifying issues, they repair or replace faulty equipment, ensuring all connections are adequate and functional. They also perform routine inspections and preventative maintenance to guarantee optimal equipment performance. Collaboration with colleagues is frequent for troubleshooting and resolving complex problems. Additionally, they maintain detailed records of facilities and equipment, adhering to manufacturer specifications and technical documentation. Demonstrating equipment to users and explaining its functionality is also a key responsibility, along with responding to inquiries and complaints.",0.24
49-2091.00,Avionics Technicians,"Individuals in this role perform diagnostic evaluations, maintenance, and repair on various electronic systems. They meticulously read technical documentation like blueprints and manuals to guide installation and assembly processes. Using a range of tools, they connect, adjust, and replace components to ensure proper functionality. Their work involves rigorous testing, both on the ground and through interpreting flight data, to identify and resolve malfunctions. They maintain detailed records of all servicing and repair activities. Coordination with colleagues and engineers is essential for effective operations and problem-solving. This role demands precision in troubleshooting and a commitment to maintaining system integrity through careful inspection and repair.",0.25
49-2092.00,"Electric Motor, Power Tool, and Related Repairers","These professionals diagnose and fix mechanical and electrical issues with various equipment. They meticulously inspect and test components to identify damage, wear, or malfunctions by using diagnostic tools and schematic drawings. After disassembling the equipment, they repair or rebuild defective parts, making precise adjustments and ensuring all connections, wiring, and contacts meet specifications. This often involves cleaning, lubricating, and reassembling components using specialized tools. They also document the repairs performed, parts utilized, and the time taken. Their work requires careful measurement of performance metrics and adherence to detailed repair guides and diagrams to restore functionality and ensure optimal operation of the equipment.",0.17
49-2093.00,"Electrical and Electronics Installers and Repairers, Transportation Equipment","Professionals in this role meticulously inspect and test electrical systems and equipment to identify and diagnose malfunctions. They utilize visual inspections, specialized testing devices, and software to pinpoint issues. Following diagnosis, they adjust, repair, or replace defective components such as wiring and relays, ensuring proper function of ignition, lighting, climate control, and safety systems. This involves splicing wires, soldering connections, and locating and rectifying circuit defects like blown fuses or malfunctioning transistors. They meticulously reassemble and test equipment post-repair, referring to schematics and manufacturer specifications to guide their work. Additionally, they install new components, cut openings, drill holes for fixtures, and maintain detailed service records of all equipment.",0.22
49-2094.00,"Electrical and Electronics Repairers, Commercial and Industrial Equipment","These professionals diagnose and resolve malfunctions in electronic systems and equipment. They meticulously test components, analyze performance data, and use schematics and specifications to identify issues. Responsibilities include calibrating instruments, repairing or replacing defective parts, and ensuring proper installation and setup. They maintain detailed logs of performance, repairs, and maintenance activities, often consulting with operators and colleagues to troubleshoot complex problems. Preventive maintenance is crucial to detect and avert potential issues before they impact operations. These individuals also coordinate with others, manage inventory of necessary parts, and may advise on product performance and improvements, ensuring equipment functions according to prescribed standards.",0.21
49-2095.00,"Electrical and Electronics Repairers, Powerhouse, Substation, and Relay","These professionals inspect and test electrical equipment and circuits to identify and address malfunctions or defects, utilizing diagnostic devices and technical diagrams. They analyze test data to understand performance and the impact of modifications, and they consult with colleagues and documentation to troubleshoot complex issues. When necessary, they isolate defective components and perform repairs or replacements. This role involves maintaining detailed records of inspections, tests, repairs, and preventative maintenance. They also manage inventories of necessary parts and communicate equipment shutdowns to relevant personnel. A key responsibility is ensuring the continued optimal functioning of critical electrical systems through diligent monitoring and proactive upkeep.",0.21
49-2096.00,"Electronic Equipment Installers and Repairers, Motor Vehicles","Professionals in this role install, troubleshoot, and repair various electronic systems within vehicles. They begin by conferring with customers to understand reported issues, then conduct thorough inspections and diagnostic tests using specialized instruments to pinpoint malfunctions. Based on these findings, they meticulously repair or replace faulty components, splice wires, and solder connections as needed. This often involves cutting openings, drilling holes, and modifying interior structures to accommodate new or existing equipment. They also install accessories, ensuring proper function, and may construct custom enclosures for audio components. Throughout the process, they maintain detailed records of tests and repair outcomes, and provide cost estimates for their services.",0.21
